{
  "schemaVersion": 1,
  "id": "default",
  "displayName": "Default",
  "ui": {
    "title": "PROOF AUTO RUNNER",
    "subtitle": "Auto Runner",
    "playHint": "JUMP  -  AUTO RUN  -  REACH THE FLAG"
  },
  "assets": [
    {
      "role": "player",
      "key": "theme/default/player",
      "spec": {
        "kind": "generated",
        "width": 28,
        "height": 44,
        "fill": "#65d0a8",
        "stroke": "#0b0d13",
        "strokeWidth": 2,
        "cornerRadius": 6
      }
    },
    {
      "role": "enemy",
      "key": "theme/default/enemy",
      "spec": {
        "kind": "generated",
        "width": 26,
        "height": 26,
        "fill": "#e05fa0",
        "stroke": "#3a0010",
        "strokeWidth": 2
      }
    },
    {
      "role": "platform",
      "key": "theme/default/platform",
      "spec": {
        "kind": "generated",
        "width": 64,
        "height": 16,
        "fill": "#39415a",
        "stroke": "#5a678f",
        "strokeWidth": 1
      }
    },
    {
      "role": "pickup",
      "key": "theme/default/pickup",
      "spec": {
        "kind": "generated",
        "width": 14,
        "height": 14,
        "fill": "#f0c274",
        "cornerRadius": 7
      }
    },
    {
      "role": "hazard",
      "key": "theme/default/hazard",
      "spec": {
        "kind": "generated",
        "width": 20,
        "height": 18,
        "fill": "#e0574f",
        "stroke": "#7a1f1a",
        "strokeWidth": 1
      }
    },
    {
      "role": "checkpoint",
      "key": "theme/default/checkpoint",
      "spec": {
        "kind": "generated",
        "width": 20,
        "height": 24,
        "fill": "#4f9ee0",
        "stroke": "#173a5c",
        "strokeWidth": 1
      }
    },
    {
      "role": "exit",
      "key": "theme/default/exit",
      "spec": {
        "kind": "generated",
        "width": 22,
        "height": 44,
        "fill": "#b98af0",
        "stroke": "#3a2159",
        "strokeWidth": 1
      }
    }
  ],
  "tokens": {
    "background": "#0b0d13",
    "panel": "#1a1f2b",
    "panelActive": "#2b3446",
    "text": "#e8ecf4",
    "accent": "#65d0a8",
    "border": "#384054"
  },
  "fonts": {
    "ui": "ui-monospace, SFMono-Regular, Menlo, Consolas, monospace"
  },
  "highContrastTokens": {
    "background": "#000000",
    "panel": "#000000",
    "panelActive": "#1a1a1a",
    "text": "#ffffff",
    "accent": "#ffe14d",
    "border": "#ffffff"
  }
}
